{
  "schemaVersion": "1.0",
  "country": "TG",
  "countryName": "Togo",
  "countryNames": {
    "fr": "Togo",
    "en": "Togo"
  },
  "timezone": "Africa/Lome",
  "year": 2026,
  "month": 6,
  "workingDaysCount": 22,
  "weekendDaysCount": 8,
  "publicHolidaysCount": 0,
  "days": [
    {
      "date": "2026-06-01",
      "dayOfWeek": 1,
      "isWeekend": false,
      "isPublicHoliday": false,
      "isWorkingDay": true,
      "isFirstWorkingDayOfMonth": true,
      "isLastWorkingDayOfMonth": false,
      "isRamadanPeriod": false,
      "confidence": "confirmed"
    },
    {
      "date": "2026-06-02",
      "dayOfWeek": 2,
      "isWeekend": false,
      "isPublicHoliday": false,
      "isWorkingDay": true,
      "isFirstWorkingDayOfMonth": false,
      "isLastWorkingDayOfMonth": false,
      "isRamadanPeriod": false,
      "confidence": "confirmed"
    },
    {
      "date": "2026-06-03",
      "dayOfWeek": 3,
      "isWeekend": false,
      "isPublicHoliday": false,
      "isWorkingDay": true,
      "isFirstWorkingDayOfMonth": false,
      "isLastWorkingDayOfMonth": false,
      "isRamadanPeriod": false,
      "confidence": "confirmed"
    },
    {
      "date": "2026-06-04",
      "dayOfWeek": 4,
      "isWeekend": false,
      "isPublicHoliday": false,
      "isWorkingDay": true,
      "isFirstWorkingDayOfMonth": false,
      "isLastWorkingDayOfMonth": false,
      "isRamadanPeriod": false,
      "confidence": "confirmed"
    },
    {
      "date": "2026-06-05",
      "dayOfWeek": 5,
      "isWeekend": false,
      "isPublicHoliday": false,
      "isWorkingDay": true,
      "isFirstWorkingDayOfMonth": false,
      "isLastWorkingDayOfMonth": false,
      "isRamadanPeriod": false,
      "confidence": "confirmed"
    },
    {
      "date": "2026-06-06",
      "dayOfWeek": 6,
      "isWeekend": true,
      "isPublicHoliday": false,
      "isWorkingDay": false,
      "isFirstWorkingDayOfMonth": false,
      "isLastWorkingDayOfMonth": false,
      "isRamadanPeriod": false,
      "confidence": "confirmed"
    },
    {
      "date": "2026-06-07",
      "dayOfWeek": 7,
      "isWeekend": true,
      "isPublicHoliday": false,
      "isWorkingDay": false,
      "isFirstWorkingDayOfMonth": false,
      "isLastWorkingDayOfMonth": false,
      "isRamadanPeriod": false,
      "confidence": "confirmed"
    },
    {
      "date": "2026-06-08",
      "dayOfWeek": 1,
      "isWeekend": false,
      "isPublicHoliday": false,
      "isWorkingDay": true,
      "isFirstWorkingDayOfMonth": false,
      "isLastWorkingDayOfMonth": false,
      "isRamadanPeriod": false,
      "confidence": "confirmed"
    },
    {
      "date": "2026-06-09",
      "dayOfWeek": 2,
      "isWeekend": false,
      "isPublicHoliday": false,
      "isWorkingDay": true,
      "isFirstWorkingDayOfMonth": false,
      "isLastWorkingDayOfMonth": false,
      "isRamadanPeriod": false,
      "confidence": "confirmed"
    },
    {
      "date": "2026-06-10",
      "dayOfWeek": 3,
      "isWeekend": false,
      "isPublicHoliday": false,
      "isWorkingDay": true,
      "isFirstWorkingDayOfMonth": false,
      "isLastWorkingDayOfMonth": false,
      "isRamadanPeriod": false,
      "confidence": "confirmed"
    },
    {
      "date": "2026-06-11",
      "dayOfWeek": 4,
      "isWeekend": false,
      "isPublicHoliday": false,
      "isWorkingDay": true,
      "isFirstWorkingDayOfMonth": false,
      "isLastWorkingDayOfMonth": false,
      "isRamadanPeriod": false,
      "confidence": "confirmed"
    },
    {
      "date": "2026-06-12",
      "dayOfWeek": 5,
      "isWeekend": false,
      "isPublicHoliday": false,
      "isWorkingDay": true,
      "isFirstWorkingDayOfMonth": false,
      "isLastWorkingDayOfMonth": false,
      "isRamadanPeriod": false,
      "confidence": "confirmed"
    },
    {
      "date": "2026-06-13",
      "dayOfWeek": 6,
      "isWeekend": true,
      "isPublicHoliday": false,
      "isWorkingDay": false,
      "isFirstWorkingDayOfMonth": false,
      "isLastWorkingDayOfMonth": false,
      "isRamadanPeriod": false,
      "confidence": "confirmed"
    },
    {
      "date": "2026-06-14",
      "dayOfWeek": 7,
      "isWeekend": true,
      "isPublicHoliday": false,
      "isWorkingDay": false,
      "isFirstWorkingDayOfMonth": false,
      "isLastWorkingDayOfMonth": false,
      "isRamadanPeriod": false,
      "confidence": "confirmed"
    },
    {
      "date": "2026-06-15",
      "dayOfWeek": 1,
      "isWeekend": false,
      "isPublicHoliday": false,
      "isWorkingDay": true,
      "isFirstWorkingDayOfMonth": false,
      "isLastWorkingDayOfMonth": false,
      "isRamadanPeriod": false,
      "confidence": "confirmed"
    },
    {
      "date": "2026-06-16",
      "dayOfWeek": 2,
      "isWeekend": false,
      "isPublicHoliday": false,
      "isWorkingDay": true,
      "isFirstWorkingDayOfMonth": false,
      "isLastWorkingDayOfMonth": false,
      "isRamadanPeriod": false,
      "confidence": "confirmed"
    },
    {
      "date": "2026-06-17",
      "dayOfWeek": 3,
      "isWeekend": false,
      "isPublicHoliday": false,
      "isWorkingDay": true,
      "isFirstWorkingDayOfMonth": false,
      "isLastWorkingDayOfMonth": false,
      "isRamadanPeriod": false,
      "confidence": "confirmed"
    },
    {
      "date": "2026-06-18",
      "dayOfWeek": 4,
      "isWeekend": false,
      "isPublicHoliday": false,
      "isWorkingDay": true,
      "isFirstWorkingDayOfMonth": false,
      "isLastWorkingDayOfMonth": false,
      "isRamadanPeriod": false,
      "confidence": "confirmed"
    },
    {
      "date": "2026-06-19",
      "dayOfWeek": 5,
      "isWeekend": false,
      "isPublicHoliday": false,
      "isWorkingDay": true,
      "isFirstWorkingDayOfMonth": false,
      "isLastWorkingDayOfMonth": false,
      "isRamadanPeriod": false,
      "confidence": "confirmed"
    },
    {
      "date": "2026-06-20",
      "dayOfWeek": 6,
      "isWeekend": true,
      "isPublicHoliday": false,
      "isWorkingDay": false,
      "isFirstWorkingDayOfMonth": false,
      "isLastWorkingDayOfMonth": false,
      "isRamadanPeriod": false,
      "confidence": "confirmed"
    },
    {
      "date": "2026-06-21",
      "dayOfWeek": 7,
      "isWeekend": true,
      "isPublicHoliday": false,
      "isWorkingDay": false,
      "isFirstWorkingDayOfMonth": false,
      "isLastWorkingDayOfMonth": false,
      "isRamadanPeriod": false,
      "confidence": "confirmed"
    },
    {
      "date": "2026-06-22",
      "dayOfWeek": 1,
      "isWeekend": false,
      "isPublicHoliday": false,
      "isWorkingDay": true,
      "isFirstWorkingDayOfMonth": false,
      "isLastWorkingDayOfMonth": false,
      "isRamadanPeriod": false,
      "confidence": "confirmed"
    },
    {
      "date": "2026-06-23",
      "dayOfWeek": 2,
      "isWeekend": false,
      "isPublicHoliday": false,
      "isWorkingDay": true,
      "isFirstWorkingDayOfMonth": false,
      "isLastWorkingDayOfMonth": false,
      "isRamadanPeriod": false,
      "confidence": "confirmed"
    },
    {
      "date": "2026-06-24",
      "dayOfWeek": 3,
      "isWeekend": false,
      "isPublicHoliday": false,
      "isWorkingDay": true,
      "isFirstWorkingDayOfMonth": false,
      "isLastWorkingDayOfMonth": false,
      "isRamadanPeriod": false,
      "confidence": "confirmed"
    },
    {
      "date": "2026-06-25",
      "dayOfWeek": 4,
      "isWeekend": false,
      "isPublicHoliday": false,
      "isWorkingDay": true,
      "isFirstWorkingDayOfMonth": false,
      "isLastWorkingDayOfMonth": false,
      "isRamadanPeriod": false,
      "confidence": "confirmed"
    },
    {
      "date": "2026-06-26",
      "dayOfWeek": 5,
      "isWeekend": false,
      "isPublicHoliday": false,
      "isWorkingDay": true,
      "isFirstWorkingDayOfMonth": false,
      "isLastWorkingDayOfMonth": false,
      "isRamadanPeriod": false,
      "confidence": "confirmed"
    },
    {
      "date": "2026-06-27",
      "dayOfWeek": 6,
      "isWeekend": true,
      "isPublicHoliday": false,
      "isWorkingDay": false,
      "isFirstWorkingDayOfMonth": false,
      "isLastWorkingDayOfMonth": false,
      "isRamadanPeriod": false,
      "confidence": "confirmed"
    },
    {
      "date": "2026-06-28",
      "dayOfWeek": 7,
      "isWeekend": true,
      "isPublicHoliday": false,
      "isWorkingDay": false,
      "isFirstWorkingDayOfMonth": false,
      "isLastWorkingDayOfMonth": false,
      "isRamadanPeriod": false,
      "confidence": "confirmed"
    },
    {
      "date": "2026-06-29",
      "dayOfWeek": 1,
      "isWeekend": false,
      "isPublicHoliday": false,
      "isWorkingDay": true,
      "isFirstWorkingDayOfMonth": false,
      "isLastWorkingDayOfMonth": false,
      "isRamadanPeriod": false,
      "confidence": "confirmed"
    },
    {
      "date": "2026-06-30",
      "dayOfWeek": 2,
      "isWeekend": false,
      "isPublicHoliday": false,
      "isWorkingDay": true,
      "isFirstWorkingDayOfMonth": false,
      "isLastWorkingDayOfMonth": true,
      "isRamadanPeriod": false,
      "confidence": "confirmed"
    }
  ]
}