{
  "schemaVersion": "1.0",
  "country": "BJ",
  "countryName": "Bénin",
  "countryNames": {
    "fr": "Bénin",
    "en": "Benin"
  },
  "timezone": "Africa/Porto-Novo",
  "year": 2026,
  "month": 1,
  "workingDaysCount": 19,
  "weekendDaysCount": 9,
  "publicHolidaysCount": 3,
  "days": [
    {
      "date": "2026-01-01",
      "dayOfWeek": 4,
      "isWeekend": false,
      "isPublicHoliday": true,
      "isWorkingDay": false,
      "isFirstWorkingDayOfMonth": false,
      "isLastWorkingDayOfMonth": false,
      "isRamadanPeriod": false,
      "confidence": "tentative"
    },
    {
      "date": "2026-01-02",
      "dayOfWeek": 5,
      "isWeekend": false,
      "isPublicHoliday": false,
      "isWorkingDay": true,
      "isFirstWorkingDayOfMonth": true,
      "isLastWorkingDayOfMonth": false,
      "isRamadanPeriod": false,
      "confidence": "confirmed"
    },
    {
      "date": "2026-01-03",
      "dayOfWeek": 6,
      "isWeekend": true,
      "isPublicHoliday": false,
      "isWorkingDay": false,
      "isFirstWorkingDayOfMonth": false,
      "isLastWorkingDayOfMonth": false,
      "isRamadanPeriod": false,
      "confidence": "confirmed"
    },
    {
      "date": "2026-01-04",
      "dayOfWeek": 7,
      "isWeekend": true,
      "isPublicHoliday": false,
      "isWorkingDay": false,
      "isFirstWorkingDayOfMonth": false,
      "isLastWorkingDayOfMonth": false,
      "isRamadanPeriod": false,
      "confidence": "confirmed"
    },
    {
      "date": "2026-01-05",
      "dayOfWeek": 1,
      "isWeekend": false,
      "isPublicHoliday": false,
      "isWorkingDay": true,
      "isFirstWorkingDayOfMonth": false,
      "isLastWorkingDayOfMonth": false,
      "isRamadanPeriod": false,
      "confidence": "confirmed"
    },
    {
      "date": "2026-01-06",
      "dayOfWeek": 2,
      "isWeekend": false,
      "isPublicHoliday": false,
      "isWorkingDay": true,
      "isFirstWorkingDayOfMonth": false,
      "isLastWorkingDayOfMonth": false,
      "isRamadanPeriod": false,
      "confidence": "confirmed"
    },
    {
      "date": "2026-01-07",
      "dayOfWeek": 3,
      "isWeekend": false,
      "isPublicHoliday": false,
      "isWorkingDay": true,
      "isFirstWorkingDayOfMonth": false,
      "isLastWorkingDayOfMonth": false,
      "isRamadanPeriod": false,
      "confidence": "confirmed"
    },
    {
      "date": "2026-01-08",
      "dayOfWeek": 4,
      "isWeekend": false,
      "isPublicHoliday": true,
      "isWorkingDay": false,
      "isFirstWorkingDayOfMonth": false,
      "isLastWorkingDayOfMonth": false,
      "isRamadanPeriod": false,
      "confidence": "tentative"
    },
    {
      "date": "2026-01-09",
      "dayOfWeek": 5,
      "isWeekend": false,
      "isPublicHoliday": true,
      "isWorkingDay": false,
      "isFirstWorkingDayOfMonth": false,
      "isLastWorkingDayOfMonth": false,
      "isRamadanPeriod": false,
      "confidence": "tentative"
    },
    {
      "date": "2026-01-10",
      "dayOfWeek": 6,
      "isWeekend": true,
      "isPublicHoliday": false,
      "isWorkingDay": false,
      "isFirstWorkingDayOfMonth": false,
      "isLastWorkingDayOfMonth": false,
      "isRamadanPeriod": false,
      "confidence": "confirmed"
    },
    {
      "date": "2026-01-11",
      "dayOfWeek": 7,
      "isWeekend": true,
      "isPublicHoliday": false,
      "isWorkingDay": false,
      "isFirstWorkingDayOfMonth": false,
      "isLastWorkingDayOfMonth": false,
      "isRamadanPeriod": false,
      "confidence": "confirmed"
    },
    {
      "date": "2026-01-12",
      "dayOfWeek": 1,
      "isWeekend": false,
      "isPublicHoliday": false,
      "isWorkingDay": true,
      "isFirstWorkingDayOfMonth": false,
      "isLastWorkingDayOfMonth": false,
      "isRamadanPeriod": false,
      "confidence": "confirmed"
    },
    {
      "date": "2026-01-13",
      "dayOfWeek": 2,
      "isWeekend": false,
      "isPublicHoliday": false,
      "isWorkingDay": true,
      "isFirstWorkingDayOfMonth": false,
      "isLastWorkingDayOfMonth": false,
      "isRamadanPeriod": false,
      "confidence": "confirmed"
    },
    {
      "date": "2026-01-14",
      "dayOfWeek": 3,
      "isWeekend": false,
      "isPublicHoliday": false,
      "isWorkingDay": true,
      "isFirstWorkingDayOfMonth": false,
      "isLastWorkingDayOfMonth": false,
      "isRamadanPeriod": false,
      "confidence": "confirmed"
    },
    {
      "date": "2026-01-15",
      "dayOfWeek": 4,
      "isWeekend": false,
      "isPublicHoliday": false,
      "isWorkingDay": true,
      "isFirstWorkingDayOfMonth": false,
      "isLastWorkingDayOfMonth": false,
      "isRamadanPeriod": false,
      "confidence": "confirmed"
    },
    {
      "date": "2026-01-16",
      "dayOfWeek": 5,
      "isWeekend": false,
      "isPublicHoliday": false,
      "isWorkingDay": true,
      "isFirstWorkingDayOfMonth": false,
      "isLastWorkingDayOfMonth": false,
      "isRamadanPeriod": false,
      "confidence": "confirmed"
    },
    {
      "date": "2026-01-17",
      "dayOfWeek": 6,
      "isWeekend": true,
      "isPublicHoliday": false,
      "isWorkingDay": false,
      "isFirstWorkingDayOfMonth": false,
      "isLastWorkingDayOfMonth": false,
      "isRamadanPeriod": false,
      "confidence": "confirmed"
    },
    {
      "date": "2026-01-18",
      "dayOfWeek": 7,
      "isWeekend": true,
      "isPublicHoliday": false,
      "isWorkingDay": false,
      "isFirstWorkingDayOfMonth": false,
      "isLastWorkingDayOfMonth": false,
      "isRamadanPeriod": false,
      "confidence": "confirmed"
    },
    {
      "date": "2026-01-19",
      "dayOfWeek": 1,
      "isWeekend": false,
      "isPublicHoliday": false,
      "isWorkingDay": true,
      "isFirstWorkingDayOfMonth": false,
      "isLastWorkingDayOfMonth": false,
      "isRamadanPeriod": false,
      "confidence": "confirmed"
    },
    {
      "date": "2026-01-20",
      "dayOfWeek": 2,
      "isWeekend": false,
      "isPublicHoliday": false,
      "isWorkingDay": true,
      "isFirstWorkingDayOfMonth": false,
      "isLastWorkingDayOfMonth": false,
      "isRamadanPeriod": false,
      "confidence": "confirmed"
    },
    {
      "date": "2026-01-21",
      "dayOfWeek": 3,
      "isWeekend": false,
      "isPublicHoliday": false,
      "isWorkingDay": true,
      "isFirstWorkingDayOfMonth": false,
      "isLastWorkingDayOfMonth": false,
      "isRamadanPeriod": false,
      "confidence": "confirmed"
    },
    {
      "date": "2026-01-22",
      "dayOfWeek": 4,
      "isWeekend": false,
      "isPublicHoliday": false,
      "isWorkingDay": true,
      "isFirstWorkingDayOfMonth": false,
      "isLastWorkingDayOfMonth": false,
      "isRamadanPeriod": false,
      "confidence": "confirmed"
    },
    {
      "date": "2026-01-23",
      "dayOfWeek": 5,
      "isWeekend": false,
      "isPublicHoliday": false,
      "isWorkingDay": true,
      "isFirstWorkingDayOfMonth": false,
      "isLastWorkingDayOfMonth": false,
      "isRamadanPeriod": false,
      "confidence": "confirmed"
    },
    {
      "date": "2026-01-24",
      "dayOfWeek": 6,
      "isWeekend": true,
      "isPublicHoliday": false,
      "isWorkingDay": false,
      "isFirstWorkingDayOfMonth": false,
      "isLastWorkingDayOfMonth": false,
      "isRamadanPeriod": false,
      "confidence": "confirmed"
    },
    {
      "date": "2026-01-25",
      "dayOfWeek": 7,
      "isWeekend": true,
      "isPublicHoliday": false,
      "isWorkingDay": false,
      "isFirstWorkingDayOfMonth": false,
      "isLastWorkingDayOfMonth": false,
      "isRamadanPeriod": false,
      "confidence": "confirmed"
    },
    {
      "date": "2026-01-26",
      "dayOfWeek": 1,
      "isWeekend": false,
      "isPublicHoliday": false,
      "isWorkingDay": true,
      "isFirstWorkingDayOfMonth": false,
      "isLastWorkingDayOfMonth": false,
      "isRamadanPeriod": false,
      "confidence": "confirmed"
    },
    {
      "date": "2026-01-27",
      "dayOfWeek": 2,
      "isWeekend": false,
      "isPublicHoliday": false,
      "isWorkingDay": true,
      "isFirstWorkingDayOfMonth": false,
      "isLastWorkingDayOfMonth": false,
      "isRamadanPeriod": false,
      "confidence": "confirmed"
    },
    {
      "date": "2026-01-28",
      "dayOfWeek": 3,
      "isWeekend": false,
      "isPublicHoliday": false,
      "isWorkingDay": true,
      "isFirstWorkingDayOfMonth": false,
      "isLastWorkingDayOfMonth": false,
      "isRamadanPeriod": false,
      "confidence": "confirmed"
    },
    {
      "date": "2026-01-29",
      "dayOfWeek": 4,
      "isWeekend": false,
      "isPublicHoliday": false,
      "isWorkingDay": true,
      "isFirstWorkingDayOfMonth": false,
      "isLastWorkingDayOfMonth": false,
      "isRamadanPeriod": false,
      "confidence": "confirmed"
    },
    {
      "date": "2026-01-30",
      "dayOfWeek": 5,
      "isWeekend": false,
      "isPublicHoliday": false,
      "isWorkingDay": true,
      "isFirstWorkingDayOfMonth": false,
      "isLastWorkingDayOfMonth": true,
      "isRamadanPeriod": false,
      "confidence": "confirmed"
    },
    {
      "date": "2026-01-31",
      "dayOfWeek": 6,
      "isWeekend": true,
      "isPublicHoliday": false,
      "isWorkingDay": false,
      "isFirstWorkingDayOfMonth": false,
      "isLastWorkingDayOfMonth": false,
      "isRamadanPeriod": false,
      "confidence": "confirmed"
    }
  ]
}